Reference	ID	Tags	Quote	Occurrence	Question	Response
1:1	y5pp				परमेश्‍वरको सेवा गर्नुमा पावलको उद्देश्‍य के थियो?	उनको उद्देश्‍य परमेश्‍वरका चुनिएकाहरूका विश्‍वास स्थापित गर्नु, र सत्यताको ज्ञान स्थापित गर्नु थियो।
1:2	ymzh				परमेश्‍वरले उहाँका चुनिएकाहरूका निम्ति अनन्‍त जीवन कहिले प्रतिज्ञा गर्नुभयो?	उहाँले यो समयको सबै युगहरूभन्दा पहिला नै प्रतिज्ञा गर्नुभयो।
1:2	eauf				के परमेश्‍वरले ढाँट्न सक्‍नुहुन्छ ?	सक्‍नुहुन्‍न।
1:3	sens				परमेश्‍वले सही समयमा आफ्नो घोषणा कसलाई सुम्पनुभयो?	परमेश्‍वरले यो प्रेरित पावललाई सुम्पनुभयो।
1:4	mzu9				तीतस र पावल बीच कस्तो सम्बन्ध थियो?	तितस पावलको साँचो छोरा जस्तै थिए किनभने तिनीहरूको साझा विश्‍वास थियो।
1:6	r6iy				एल्डरको श्रीमती र छोराछोरी कस्तो हुनुपर्छ?	उहाँ एउटै पत्‍नीको पति हुनुपर्दछ र उहाँका विश्‍वासी छोराछोरीहरू हुनुपर्दछ जो लापरवाह व्यवहार वा विद्रोहको आरोपमा छैनन्।
1:7	m2kk				एल्डरले निर्दोष हुन बेवास्ता गर्नुपर्ने केही चरित्र विशेषताहरू के हुन्?	ऊ घमण्डी वा सजिलै रिसाउने वा रक्सीको लत वा झगडा गर्ने वा लोभी हुनुहुँदैन।
1:7	utuv				परमेश्‍वरको परिवारमा निरीक्षकको कस्तो ओहदा र जिम्मेवारी हुन्छ?	उहाँ परमेश्‍वरको घरको व्यवस्थापक जस्तै हुनुहुन्छ।
1:8	b1wn				एल्डरमा कस्ता असल गुणहरू हुनुपर्छ?	एल्डर अतिथि सत्कार गर्ने, असल, समझदार, धर्मी, पवित्र र आत्मसंयमी हुनु पर्छ।
1:9	bb4z				आफूलाई सिकाइएको सन्देशप्रति एल्डरको मनोवृत्ति कस्तो हुनुपर्छ?	उसले यसलाई बलियोसँग समात्‍नुपर्दछ, र यसरी, अरूलाई प्रोत्साहन र हप्काउन सक्षम हुनुपर्दछ।
1:11	fu01				झूटा शिक्षकहरूले तिनीहरूको शिक्षाद्वारा के गर्दै थिए?	तिनीहरूले सम्पूर्ण घरपरिवारलाई त्रसित बनाए।
1:11	zqwf				झूटा शिक्षकहरूले के चाहेका थिए?	तिनीहरू लाजमर्दो लाभ चाहन्थे।
1:13	ncbn				मण्डलीलाई हानि पुर्‍याउने यी झूटा शिक्षकहरूलाई एल्डरले कस्तो व्यवहार गर्नुपर्छ?	उहाँले तिनीहरूलाई कडा रूपमा हप्काउनुपर्छ ताकि तिनीहरू विश्‍वासमा स्थिर हुन सकून्।
1:14	l4re				पावलले कुन कुरामा ध्यान दिनु हुँदैन भन्‍नुभयो?	तिनीहरूले यहूदी पौराणिक कथाहरू र मानिसहरूका आज्ञाहरूमा ध्यान दिनु हुँदैन।
1:15	n9lr				अविश्‍वासी मानिसमा के भ्रष्ट हुन्छ?	उसको मन र विवेक दुवै भ्रष्ट हुन्छ।\n\n
1:16	feiw				भ्रष्ट मानिसले परमेश्‍वरलाई  चिनेको दाबी गरे तापनि उसले उहाँलाई कसरी इन्कार गर्छ?	उसले आफ्नो कार्यद्वारा परमेश्‍वरलाई इन्कार गर्छ।
2:2	l08x				मण्डलीका बूढा मानिसहरूमा हुने केही विशेषताहरू के-के हुन्?\n\n	तिनीहरू संयमी, सम्मानित, समझदार, र विश्‍वासमा, प्रेममा, र लगनशील हुनुपर्दछ।
2:3	piyt				मण्डलीका वृद्ध महिलाहरूमा हुने केही विशेषताहरू के-के हुन्?\n\n	तिनीहरू आदरणीय, संयमित हुनुपर्छ, निन्दा गर्ने होइन, राम्रो कुराको शिक्षक हुनुपर्दछ।\n\n
2:4	ccz2				वृद्ध महिलाहरूले जवान महिलाहरूलाई के गर्न सिकाउनुपर्छ?	तिनीहरूले तिनीहरूलाई आफ्नो पतिलाई माया गर्न र आज्ञा पालन गर्न, र आफ्ना छोराछोरीलाई माया गर्न सिकाउनुपर्छ।\n\n
2:7	jlut				तीतसले आफूलाई असल कामहरूको उदाहरणको रूपमा कसरी प्रस्तुत गर्नुपर्छ?\n\n	उहाँको शिक्षामा, उहाँ भ्रष्ट हुनुपर्दछ, मर्यादाका साथ काम गर्नुपर्दछ, र आलोचना भन्दा माथिको राम्रो सन्देश दिनुपर्दछ।\n\n
2:8	idm5				यदि तितस राम्रो उदाहरण हुन् भने विरोध गर्नेहरूलाई के हुनेछ?	उहाँको विरोध गर्नेहरू लज्जित हुनेछन् किनभने तिनीहरूसँग उहाँको बारेमा केही नराम्रो कुरा छैन।\n\n
2:9	v4mn				विश्‍वासी दासहरूले कस्तो व्यवहार गर्नुपर्छ?	तिनीहरूले आफ्ना मालिकहरूको आज्ञापालन गर्नुपर्छ, खुसी हुनुपर्दछ, र तर्क गर्नु हुँदैन।\n\n
2:10	rmsh				जब ख्रीष्टियन दासहरूले पावलले निर्देशन दिएअनुसार व्यवहार गर्छन्, त्यसले अरूलाई कस्तो असर गर्छ?	यसले हाम्रा मुक्तिदाता परमेश्‍वरको बारेमा शिक्षालाई श्रेय दिनेछ।
2:11	n5o4				परमेश्‍वरको कृपाले कसलाई बचाउन सक्छ?	परमेश्‍वरको कृपाले सबैलाई बचाउन सक्छ।
2:12	o3ri				परमेश्‍वरको अनुग्रहले हामीलाई के अस्वीकार गर्न तालिम दिन्छ?	परमेश्‍वरको अनुग्रहले हामीलाई ईश्‍वरहीनता  र सांसारिक इच्छाहरू अस्वीकार गर्न तालिम दिन्छ।
2:13	ytj1				विश्‍वासीहरू कस्तो भविष्यको घटना प्राप्त गर्न उत्सुक छन्?	विश्‍वासीहरू धन्य आशा प्राप्त गर्न तत्पर छन्: हाम्रा महान् परमेश्‍वर र मुक्तिदाता येशू ख्रीष्टको महिमाको उपस्थिति।
2:14	fk1b				किन येशूले हाम्रो लागि आफैलाई अर्पण गर्नुभयो?\n\n	हामीलाई अधर्मबाट छुटकारा दिन र असल काम गर्न जोसिलो हुने मानिसहरूलाई शुद्ध पार्न उहाँले आफूलाई अर्पण गर्नुभयो।\n\n
3:1	i6ns				शासकहरू र अधिकारीहरूप्रति विश्‍वासीको दृष्टिकोण कस्तो हुनुपर्छ?	विश्‍वासीले तिनीहरूलाई समर्पण गर्नुपर्छ र तिनीहरूको आज्ञापालन गर्नुपर्छ, र हरेक राम्रो कामको लागि तयार हुनुपर्छ।
3:3	zgen				कुन कुराले अविश्‍वासीहरूलाई  बहकाउँछ र तिनीहरूलाई दास बनाउँछ?	तिनीहरूका विभिन्‍न आकांक्षाहरू र आनन्दहरूले तिनीहरूलाई भ्रामक बनाउँछन् र तिनीहरूलाई दास बनाउँछन्।
3:5	cerb				परमेश्‍वरले हामीलाई कुन माध्यमबाट बचाउनुभयो?	उहाँले हामीलाई नयाँ जन्मको धुलाई र पवित्र आत्माको नवीकरणद्वारा बचाउनुभयो।
3:5	vfdd				हामीले गरेका असल कामहरूको कारणले वा परमेश्‍वरको  कृपा, कुन कुराले गर्दा हामीले मुक्ति पाएका छौं?	हामी केवल परमेश्‍वरको कृपाले बचेका छौं।
3:7	tclv				उहाँले हामीलाई धर्मी ठहराएपछि, परमेश्‍वरले हामीलाई के बनाइदिनुहुन्छ?	परमेश्‍वरले हामीलाई उहाँको उत्तराधिकारी बनाउनुहुन्छ।
3:8	cvv3				विश्‍वासीहरूले के गर्न होसियार हुनुपर्छ?	विश्‍वासीहरूले राम्रो काम गर्न होसियार हुनुपर्छ।
3:9	lgio				विश्‍वासीहरूले केबाट बच्‍नुपर्छ?	विश्‍वासीहरू मूर्खतापूर्ण बहसहरू, वंशावलीहरू, झगडाहरू, र धार्मिक कानूनको बारेमा विवादबाट टाढा रहनुपर्छ।
3:10	lapn				एक वा दुई चेतावनी पछि हामीले कसलाई अस्वीकार गर्नुपर्छ?	हामीले विभाजनकारी व्यक्तिलाई अस्वीकार गर्नुपर्छ।\n\n
3:14	i5lu				विश्‍वासीहरूले फलदायी हुनको लागि आफूलाई केमा संलग्‍न गर्नुपर्छ?	विश्‍वासीहरूले आवश्यक आवश्यकताहरू पूरा गर्न असल कामलाई जोड्न सिक्नुहोस्।
