Reference	ID	Tags	SupportReference	Quote	Occurrence	Note
2:intro	jq9r				0	# २ थेसलोनिकीहरू ०२ सामान्य टिपोटहरू\n\n## यस अध्यायमा भएका विशेष अवधारणाहरू\n\n### “उहाँसँगै हुन एकसाथ भेला गराइने”\n\nयस खण्‍डले त्यो एउटा समयलाई जनाउँछ जब येशूले उहाँमा विश्‍वास गरेकाहरूलाई आफूकहाँ बोलाउनुहुनेछ । यसले ख्रीष्‍टको अन्तिम महिमामय पुनरागमनलाई जनाउँछ वा जनाउँदैन भन्‍ने विषयमा विद्वानहरू फरक‍-फरक मत राख्‍छन् । (हेर्नुहोस्ः [[rc://ne/tw/dict/bible/kt/believe]])\n\n### पापको मानिस\nयो र यस अध्यायमा “विनाशको पुत्र” र “व्यवस्थाहीन व्यक्ति” भनेर बताइएको कुरा एउटै हो । पावलले त्यसलाई संसारमा सक्रिय रूपमा काम गरिरहेको शैतानसँग सम्बन्धित भएको देखाउँछन् । (हेर्नुहोस्ः [[rc://ne/tw/dict/bible/kt/antichrist]])\n\n### परमेश्‍वरको मन्दिरमा बस्छ\nपावलले यरूशलेमको मन्दिरलाई जनाइरहेका हुनसक्छन् जसलाई उनले यो पत्र लेखेका धेरै वर्षपछि रोमीहरूले तहसनहस पारे । अथवा उनले भविष्‍यको भौतिक मन्दिरलाई जनाइरहेका हुन सक्छन्, वा परमेश्‍वरको आत्मिक मन्दिरको रूपमा भएको मण्‍डलीलाई जनाइरहेका हुन सक्छन् । (हेर्नुहोस्ः [[rc://ne/ta/man/translate/figs-explicit]])
2:1	r36t			सामान्य जानकारीः	0	पावलले विश्‍वासीहरूलाई येशू फर्कनुहुने दिनको बारेमा धोकामा नपर्न सल्लाह दिए ।
2:1	q1uq			δὲ	1	“अब” शब्दले पावलको निर्देशनहरूको विषय परिवर्तनलाई अङ्कित गर्छ ।
2:1	cvg5		rc://*/ta/man/translate/figs-gendernotations	ἀδελφοί	1	यहाँ “भाइहरू”ले पुरुष र स्‍त्री दुवै गरेर सङ्गी ख्रीष्‍टिएनहरूलाई जनाउँछ । वैकल्‍पिक अनुवादः “दाजुभाइ तथा दिदीबहिनीहरू” (हेर्नुहोस्ः [[rc://ne/ta/man/translate/figs-gendernotations]])
2:2	b8b2			εἰς τὸ μὴ ταχέως σαλευθῆναι ὑμᾶς & μηδὲ θροεῖσθαι	1	“कि तिमीहरूले आफैँलाई सजिलै विचलित हुन नदेओ”
2:2	d334			διὰ πνεύματος, μήτε διὰ λόγου, μήτε δι’ ἐπιστολῆς, ὡς δι’ ἡμῶν	1	“बोलिएको शब्द वा लिखित अक्षरद्वारा, जसले हामीबाट आएको भान पार्छ”
2:2	k4dk			ὡς ὅτι	1	“भन्दै कि”
2:2	ib6m			ἡ ἡμέρα τοῦ Κυρίου	1	यसले त्यो समयलाई जनाउँछ जब येशू पृथ्वीमा सबै विश्‍वासीहरूका लागि फर्केर आउनुहुनेछ ।
2:3	l9c5			सामान्य जानकारीः	0	पावलले पापको मानिसको बारेमा सिकाउँछन् ।
2:3	ej66			μὴ ἔλθῃ	1	“प्रभुको दिन आउनेछैन”
2:3	y7ch			ἡ ἀποστασία	1	यसले भविष्यको त्यो समयलाई जनाउँछ जब धेरै मानिसहरू परमेश्‍वरबाट तर्केर जानेछन् ।
2:3	e86v		rc://*/ta/man/translate/figs-activepassive	ἀποκαλυφθῇ ὁ ἄνθρωπος τῆς ἀνομίας	1	यसलाई कर्तृ वाच्यमा व्यक्त गर्न सकिन्‍छ । वैकल्पिक अनुवादः “परमेश्‍वरले पापको मानिसलाई प्रकट गर्नुहुनेछ” (हेर्नुहोस्ः [[rc://ne/ta/man/translate/figs-activepassive]])
2:3	tkg9		rc://*/ta/man/translate/figs-metaphor	ὁ υἱὸς τῆς ἀπωλείας	1	पावलले विनाश चाहिँ कुनै एक व्यक्ति भए जसरी कुरा गर्छन् जसले एउटा छोरा जन्मायो जुन छोराको लक्ष्य चाहिँ सबैथोकलाई पूर्णतया नाश पार्नु हो । वैकल्पिक अनुवादः “त्यो जसले आफूले सकेको सबैथोकलाई नाश पार्छ” (हेर्नुहोस्ः [[rc://ne/ta/man/translate/figs-metaphor]])
2:4	t485		rc://*/ta/man/translate/figs-activepassive	πάντα λεγόμενον θεὸν ἢ σέβασμα	1	यसलाई कर्तृ वाच्यमा व्यक्त गर्न सकिन्छ । वैकल्पिक अनुवादः “सबैथोक जसलाई मानिसहरूले परमेश्‍वर ठान्छन् वा ती सबैथोक जसलाई मानिसहरूले आराधना गर्छन्” (हेर्नुहोस्ः [[rc://ne/ta/man/translate/figs-activepassive]])
2:4	wj33			ἀποδεικνύντα ἑαυτὸν ὅτι ἔστιν Θεός	1	“आफैँलाई परमेश्‍वरको रूपमा देखाउँछ”
2:5	rsz1		rc://*/ta/man/translate/figs-rquestion	οὐ μνημονεύετε & ταῦτα	1	पावलले आफू तिनीहरूसँग हुँदा उनले तिनीहरूलाई सिकाएका कुराहरूको स्मरण गराउन एउटा आलङ्कारिक प्रश्‍नको प्रयोग गर्छन् । यसलाई एउटा अभिव्यक्तिको रूपमा व्यक्त गर्न सकिन्छ । वैकल्पिक अनुवादः “तिमीहरूले ... यी कुराहरू ... सम्झन्छौ भनेर म निश्‍चित छु ।” (हेर्नुहोस्ः [[rc://ne/ta/man/translate/figs-rquestion]])
2:5	lkk7			ταῦτα	1	यसले येशूको पुनरागमन, प्रभुको दिन र पापको मानिसलाई जनाउँछ ।
2:6	ask4		rc://*/ta/man/translate/figs-activepassive	τὸ ἀποκαλυφθῆναι αὐτὸν ἐν τῷ αὐτοῦ καιρῷ	1	यसलाई कर्तृ वाच्यमा व्यक्त गर्न सकिन्‍छ । वैकल्पिक अनुवादः “परमेश्‍वरले पापको मानिसलाई ठीक समयमा प्रकट गर्नुहुनेछ” (हेर्नुहोस्ः [[rc://ne/ta/man/translate/figs-activepassive]])
2:7	si9i			μυστήριον & τῆς ἀνομίας	1	यसले परमेश्‍वरले मात्र जान्‍नुहुने पवित्र रहस्यलाई जनाउँछ ।
2:7	fcu7			ὁ κατέχων	1	कसैलाई रोक्‍नु भनेको तिनीहरूलाई पछाडि नै थामेर राख्‍नु वा तिनीहरूले गर्न चाहेका कुरा गर्नदेखि रोक्‍नु भनेको हो ।
2:8	hn67		rc://*/ta/man/translate/figs-activepassive	καὶ τότε ἀποκαλυφθήσεται ὁ ἄνομος	1	यसलाई कर्तृ वाच्यमा व्यक्त गर्न सकिन्छ । वैकल्पिक अनुवादः “त्यसपछि परमेश्‍वरले पापको मानिसलाई आफैँलाई प्रकट गर्न दिनुहुनेछ” (हेर्नुहोस्ः [[rc://ne/ta/man/translate/figs-activepassive]])
2:8	vay9		rc://*/ta/man/translate/figs-metonymy	τῷ πνεύματι τοῦ στόματος αὐτοῦ	1	यहाँ “सास”ले परमेश्‍वरको शक्तिलाई प्रतिनिधित्व गर्छ । वैकल्पिक अनुवादः “उहाँको बोलिएको वचनको शक्तिले” (हेर्नुहोस्ः [[rc://ne/ta/man/translate/figs-metonymy]])
2:8	hy3y			καὶ καταργήσει τῇ ἐπιφανείᾳ τῆς παρουσίας αὐτοῦ	1	जब येशू पृथ्वीमा फर्कनुहुन्छ र आफैँलाई प्रकट गर्नुहुन्छ, उहाँले पापको मानिसलाई हराउनुहुनेछ ।
2:9	bd5m			ἐν πάσῃ δυνάμει, καὶ σημείοις, καὶ τέρασιν ψεύδους	1	“सबै किसिमका शक्ति, चिन्हहरू र झूटा आश्‍चर्यकर्महरूले”
2:10	tf75			ἐν πάσῃ ἀπάτῃ ἀδικίας	1	यस व्यक्तिले मानिसहरूलाई परमेश्‍वरको साटोमा आफूमाथि विश्‍वास गर्न लगाउनका निमित्त हर किसिमको छलको प्रयोग गर्नेछ ।
2:10	v366			τοῖς ἀπολλυμένοις	1	शैतानद्वारा शक्ति दिइएको यस मानिसले ती सबैलाई छल्नेछ जसले येशूमा विश्‍वास गरेनन् ।
2:10	pf48			ἀπολλυμένοις	1	यहाँ “नाश भइरहेका” भन्‍ने कुरामा सदाकालको वा अनन्त विनाशको अवधारणा रहेको छ ।
2:11	sj1v			διὰ τοῦτο	1	“किनभने मानिसहरूले सत्यलाई प्रेम गर्दैनन्”
2:11	en8e		rc://*/ta/man/translate/figs-metaphor	πέμπει αὐτοῖς ὁ Θεὸς ἐνέργειαν πλάνης, εἰς τὸ πιστεῦσαι αὐτοὺς τῷ ψεύδει	1	परमेश्‍वरले तिनीहरूमाथि केही हुनलाई अनुमति दिइरहनुभएको कुराको विषयमा पावलले यसरी बताउँछन् कि मानौँ त्यो भनेको उहाँले तिनीहरूकहाँ केही कुरा पठाइरहनुभएको जस्तो हो । वैकल्पिक अनुवादः “परमेश्‍वरले तिनीहरूलाई छल्‍नको लागि पापको मानिसलाई अनुमति दिइरहनुभएको छ” (हेर्नुहोस्ः [[rc://ne/ta/man/translate/figs-metaphor]])
2:12	d63e		rc://*/ta/man/translate/figs-activepassive	κριθῶσιν πάντες	1	यसलाई कर्तृ वाच्यमा व्यक्त गर्न सकिन्छ । वैकल्पिक अनुवादः “परमेश्‍वरले तिनीहरू सबैको न्याय गर्नुहुनेछ” (हेर्नुहोस्ः [[rc://ne/ta/man/translate/figs-activepassive]])
2:12	pkw8			οἱ μὴ πιστεύσαντες τῇ ἀληθείᾳ, ἀλλὰ εὐδοκήσαντες τῇ ἀδικίᾳ	1	“अधार्मिकतामा आनन्द लिनेहरू किनभने तिनीहरूले सत्यतालाई विश्‍वास गरेनन्”
2:13	w83a			सामान्य जानकारीः	0	पावलले सारा विश्‍वासीहरूको निम्ति परमेश्‍वरलाई धन्यवाद दिन्छन् र तिनीहरूलाई उत्साह दिन्छन् ।
2:13	bcd5			जोड्ने कथनः	0	पावलले अब विषयलाई बदल्छन् ।
2:13	b3hh			δὲ	1	पावलले यहाँ यो शब्दलाई विषयमा आएको परिवर्तनलाई अङ्कित गर्नको लागि प्रयोग गर्छन् ।
2:13	dze5		rc://*/ta/man/translate/figs-hyperbole	ἡμεῖς & ὀφείλομεν εὐχαριστεῖν & πάντοτε	1	“सधैँ” शब्द सामान्यकरण गरिएको हो । वैकल्पिक अनुवादः “हामीले निरन्तर धन्यवाद दिनुपर्छ” (हेर्नुहोस्ः [[rc://ne/ta/man/translate/figs-hyperbole]])
2:13	m418			ἡμεῖς & ὀφείλομεν	1	यहाँ “हामी”ले पावल, सिलास र तिमोथीलाई जनाउँछ ।
2:13	ia4x		rc://*/ta/man/translate/figs-activepassive	ἀδελφοὶ ἠγαπημένοι ὑπὸ Κυρίου	1	यसलाई कर्तृ वाच्यमा व्यक्त गर्न सकिन्छ । वैकल्पिक अनुवादः “किनभने प्रभुले तिमीहरूलाई प्रेम गर्नुहुन्छ, भाइहरू हो” (हेर्नुहोस्ः [[rc://ne/ta/man/translate/figs-activepassive]])
2:13	v15j		rc://*/ta/man/translate/figs-gendernotations	ἀδελφοὶ	1	यहाँ “भाइहरू”को अर्थ पुरुष र स्‍त्री दुवै गरेर सङ्गी ख्रीष्‍टिएनहरू भन्‍ने हुन्छ । वैकल्‍पिक अनुवादः “दाजुभाइ तथा दिदीबहिनीहरू” (हेर्नुहोस्ः [[rc://ne/ta/man/translate/figs-gendernotations]])
2:13	l7a8		rc://*/ta/man/translate/figs-metaphor	ἀπαρχὴν εἰς σωτηρίαν ἐν ἁγιασμῷ Πνεύματος καὶ πίστει ἀληθείας	1	मुक्ति पाउनेमा पहिला मानिसहरू हुने कुराको विषयमा यसरी बताइएको छ कि मानौँ थेसलोनिकी विश्‍वासीहरू चाहिँ “प्रथम फलहरू” हुन् । यसलाई “मुक्ति”, “शुद्धिकरण”, “विश्‍वास”, र “सत्यता” जस्ता भाववाचक नामपद शब्दहरूलाई हटाउने गरेर पनि व्यक्त गर्न सकिन्छ । वैकल्पिक अनुवादः “ती मानिसहरूमध्येमा पहिलो हुनु जसले सत्य कुरालाई विश्‍वास गर्छन्, र जसलाई परमेश्‍वरले उहाँको आत्माद्वारा बचाउनुभएको छ र आफ्‍नै लागि अलग गर्नुभएको छ” (हेर्नुहोस्ः [[rc://ne/ta/man/translate/figs-metaphor]] अनि [[rc://ne/ta/man/translate/figs-abstractnouns]])
2:15	u9ss			ἄρα οὖν, ἀδελφοί, στήκετε	1	पावलले विश्‍वासीहरूलाई येशूमा भएको तिनीहरूको विश्‍वासमा स्थिर रहनलाई अर्ती दिन्छन् ।
2:15	l4vr		rc://*/ta/man/translate/figs-metaphor	κρατεῖτε τὰς παραδόσεις	1	यहाँ “परम्पराहरू”ले पावल र अन्य प्रेरितहरूले सिकाएका ख्रीष्‍टको सत्यताहरूलाई जनाउँछ । पावलले ती कुराहरूको विषयमा यसरी बताउँछन् कि मानौँ उनका पाठकहरूले ती कुराहरूलाई तिनीहरूका हातले पक्रन सक्थे । वैकल्‍पिक अनुवादः “परम्‍पराहरूलाई सम्झ” वा “सत्यताहरूलाई विश्‍वास गर” (हेर्नुहोस्ः [[rc://ne/ta/man/translate/figs-metaphor]])
2:15	whp8		rc://*/ta/man/translate/figs-activepassive	ἐδιδάχθητε	1	यसलाई कर्तृ वाच्यमा व्यक्त गर्न सकिन्छ । वैकल्पिक अनुवादः “हामीले तिमीहरूलाई सिकाएका छौँ” (हेर्नुहोस्ः [[rc://ne/ta/man/translate/figs-activepassive]])
2:15	z2vs		rc://*/ta/man/translate/figs-explicit	εἴτε διὰ λόγου, εἴτε δι’ ἐπιστολῆς ἡμῶν	1	यहाँ “वचनद्वारा” भनेको “निर्देशनहरूद्वारा” वा “शिक्षाहरूद्वारा”को लागि प्रतिस्थापकीय शब्द हो । तपाईंले अन्तर्निहित जानकारीलाई स्पष्‍ट बनाउन सक्नुहुन्छ । वैकल्पिक अनुवादः “हामीले व्यक्तिगत रूपमा भेटेर तिमीहरूलाई सिकाएका कुराहरूद्वारा वा हाम्रा पत्रमा हामीले तिमीहरूलाई लेखेका कुराहरूद्वारा” (हेर्नुहोस्ः [[rc://ne/ta/man/translate/figs-explicit]] अनि [[rc://ne/ta/man/translate/figs-synecdoche]])
2:16	njk1			जोड्ने कथनः	0	पावलले परमेश्‍वरबाटको आशिष्‌को साथ अन्‍त्‍य गर्छन् ।
2:16	g8m1			δὲ	1	यहाँ पावलले यो शब्दलाई विषयमा आएको परिवर्तनलाई अङ्कित गर्नको निम्ति प्रयोग गर्छन् ।
2:16	yge9		rc://*/ta/man/translate/figs-inclusive	δὲ ὁ Κύριος ἡμῶν & ὁ ἀγαπήσας ἡμᾶς καὶ δοὺς	1	“हाम्रा” र “हामीलाई” शब्दहरूले सारा विश्‍वासीहरूलाई जनाउँछन् । (हेर्नुहोस्ः [[rc://ne/ta/man/translate/figs-inclusive]])
2:16	cm54		rc://*/ta/man/translate/figs-rpronouns	αὐτὸς & ὁ Κύριος & Ἰησοῦς Χριστὸς	1	यहाँ “आफैँ” भन्‍ने वाक्यांशले “प्रभु येशू ख्रीष्‍ट” भन्‍ने वाक्यांशमा थप जोड दिन्छ । (हेर्नुहोस्ः [[rc://ne/ta/man/translate/figs-rpronouns]])
2:17	x3rr		rc://*/ta/man/translate/figs-metonymy	παρακαλέσαι ὑμῶν τὰς καρδίας, καὶ στηρίξαι ἐν	1	“हृदयहरू”ले भावनाहरूको आसनलाई प्रतिनिधित्व गर्छ । वैकल्पिक अनुवादः “ ... को लागि तिमीहरूलाई सान्त्वना दिनुभएको होस् र बलिया बनाउनुभएको होस्” (हेर्नुहोस्ः [[rc://ne/ta/man/translate/figs-metonymy]])
2:17	yw5f			παντὶ ἔργῳ καὶ λόγῳ ἀγαθῷ	1	“तिमीहरूले गर्ने र भन्‍ने हरेक असल कुरा”
3:intro	b8hk				0	# २ थेसलोनिकीहरू ०३ सामान्य टिपोटहरू\n\n## यस अध्यायमा भएका विशेष अवधारणाहरू\n\n### निष्‍क्रिय र अल्छे व्यक्तिहरू\nथेसलोनिकेमा, यस्तो देखिन्छ कि त्यहाँ काम गर्न सकेर पनि काम गर्नलाई इन्कार गर्ने मानिसहरूको कारण समस्या आएको थियो । (हेर्नुहोस्ः [[rc://ne/ta/man/translate/figs-explicit]])\n\n### तिमीहरूको भाइले पाप गर्छ भने तिमीहरूले के गर्नुपर्छ ?\n\nयस अध्यायमा, ख्रीष्‍टिएनहरूले परमेश्‍वरलाई आदर गर्ने तरिकाले जीवन जिउनुपर्छ भनेर पावलले सिकाउँछन् । ख्रीष्‍टिएनहरूले एक अर्कालाई उत्साह पनि दिनुपर्छ र तिनीहरूले गरेका कुराको लागि एक अर्कालाई जिम्मेवार पनि ठहराउनुपर्छ । विश्‍वासीहरूले पाप गर्छन् भने तिनीहरूलाई पश्‍चात्ताप गर्नलाई हौसला दिनको निम्ति पनि मण्डली जिम्मेवार हुन्छ । (हेर्नुहोस्ः [[rc://ne/tw/dict/bible/kt/repent]] अनि [[rc://ne/tw/dict/bible/kt/sin]])
3:1	k33i			सामान्य जानकारीः	0	पावलले विश्‍वासीहरूलाई उनी र उनका सहकर्मीहरूको निम्ति प्रार्थना गर्नलाई अनुरोध गर्छन् ।
3:1	jy75			τὸ λοιπὸν	1	पावलले “अब” शब्दलाई विषयमा आएको परिवर्तनलाई अङ्कित गर्नको लागि प्रयोग गर्छन् ।
3:1	m1s5		rc://*/ta/man/translate/figs-gendernotations	ἀδελφοί	1	यहाँ “भाइहरू”ले पुरुष र स्‍त्री दुवै गरेर सङ्गी ख्रीष्‍टिएनहरूलाई जनाउँछ । वैकल्‍पिक अनुवादः “दाजुभाइ तथा दिदीबहिनीहरू” (हेर्नुहोस्ः [[rc://ne/ta/man/translate/figs-gendernotations]])
3:1	r54v		rc://*/ta/man/translate/figs-metaphor	ἵνα ὁ λόγος τοῦ Κυρίου τρέχῃ καὶ δοξάζηται, καθὼς καὶ πρὸς ὑμᾶς	1	पावलले परमेश्‍वरको वचन फैलने कुरालाई त्यो कुनै एक ठाउँदेखि अर्को ठाउँसम्‍म दौडिरहेको झैँ गरी व्यक्त गर्छन् । यसलाई कर्तृ वाच्यमा व्यक्त गर्न सकिन्छ । वैकल्पिक अनुवादः “ताकि धेरैभन्दा धेरै मानिसहरूले हाम्रा प्रभु येशूको बारेमा भएको सन्देश चाँडै सुन्‍नेछन् र त्यसलाई सम्‍मान गर्नेछन्, जसरी त्यो तिमीहरूलाई पनि भयो” (हेर्नुहोस्ः [[rc://ne/ta/man/translate/figs-metaphor]] अनि [[rc://ne/ta/man/translate/figs-activepassive]])
