Reference	ID	Tags	SupportReference	Quote	Occurrence	Note
12:33	ll9t		rc://*/ta/man/translate/figs-idiom	περισσότερόν ἐστιν	1	यो टुक्‍काको अर्थ एउटाभन्दा अर्को बढी महत्त्वपूर्ण छ भन्‍ने हुन्छ । यस मामलामा यी दुईवटा आज्ञाहरू परमेश्‍वरलाई होमबलि र बलिदानभन्दा पनि बढि मनपर्दा छन् । यसलाई स्पष्‍ट पारेर लेख्‍न सकिन्छ । वैकल्पिक अनुवादः “भन्दा पनि बढि महत्त्वपूर्ण छ” वा “भन्दा पनि परमेश्‍वरलाई बढि मनपर्दो छ” (हेर्नुहोस्ः [[rc://ne/ta/man/translate/figs-idiom]])
12:34	b144		rc://*/ta/man/translate/figs-litotes	οὐ μακρὰν εἶ ἀπὸ τῆς Βασιλείας τοῦ Θεοῦ	1	यसलाई सकारात्मक रूपमा उल्लेख गर्न सकिन्छ । यहाँ येशूले मानिस परमेश्‍वरप्रति राजाको रूपमा समर्पित हुन तयार भएको कुरालाई परमेश्‍वरको राज्यको नजिक भएजस्तै गरी बोल्नुहुन्छ, मानौँ त्यो कुनै भौतिक स्थान हो । वैकल्पिक अनुवादः “तिमीहरू राजाको रूपमा परमेश्‍वरको अधीनमा हुन नजिकै छौ” (हेर्नुहोस्ः [[rc://ne/ta/man/translate/figs-litotes]] अनि [[rc://ne/ta/man/translate/figs-metaphor]])
12:34	rgh8		rc://*/ta/man/translate/figs-litotes	οὐδεὶς & ἐτόλμα	1	यसलाई सकारात्मक रूपमा उल्लेख गर्न सकिन्छ । वैकल्पिक अनुवादः “सबै डराए” (हेर्नुहोस्ः [[rc://ne/ta/man/translate/figs-litotes]])
12:35	ptc8		rc://*/ta/man/translate/figs-explicit	ἀποκριθεὶς ὁ Ἰησοῦς ἔλεγεν διδάσκων ἐν τῷ ἱερῷ	1	केही समय बितेको थियो र अहिले येशू मन्दिरमा हुनुहुन्छ । यो अगिल्‍लो वार्तालापको अंश होइन । वैकल्पिक अनुवादः “पछि, जब येशूले मन्दिरमा सिकाइरहनुभएको थियो, उहाँले मानिसहरूलाई भन्‍नुभयो” (हेर्नुहोस्ः [[rc://ne/ta/man/translate/figs-explicit]])
12:35	q6e4		rc://*/ta/man/translate/figs-rquestion	πῶς λέγουσιν οἱ γραμματεῖς ὅτι ὁ Χριστὸς, υἱὸς Δαυείδ ἐστιν?	1	येशूले उद्धृत गर्न लाग्‍नुभएको भजनसंग्रहबारे मानिसहरूलाई गहनतापूर्वक सोच्‍न लगाउन यो प्रश्‍नको प्रयोग गर्नुहुन्छ । यसलाई कथनको रूपमा लेख्‍न सकिन्छ । वैकल्पिक अनुवादः “शास्‍त्रीहरूले ख्रीष्‍टलाई किन दाऊदका पुत्र भन्छन् भनी विचार गर ।” (हेर्नुहोस्ः [[rc://ne/ta/man/translate/figs-rquestion]])
12:35	i6a4			υἱὸς Δαυείδ	1	“दाऊदको स‍न्तान”
12:36	e1zq		rc://*/ta/man/translate/figs-rpronouns	αὐτὸς Δαυεὶδ	1	“आफैँले” शब्दले दाऊदलाई जनाउँछ अनि तिनमा र तिनले भनेका कुरामा जोड दिनलाई प्रयोग गरिएको छ । वैकल्पिक अनुवादः “ती दाऊद थिए जसले” (हेर्नुहोस्ः [[rc://ne/ta/man/translate/figs-rpronouns]])
12:36	ejy2		rc://*/ta/man/translate/figs-idiom	ἐν τῷ Πνεύματι τῷ ἁγίῳ	1	यसको अर्थ तिनी पवित्र आत्माद्वारा प्रेरित थिए भन्‍ने हुन्छ । अर्थात, दाऊदले बोलेका कुराहरूलाई पवित्र आत्माले निर्देशन गर्नुभयो । वैकल्पिक अनुवादः “पवित्र आत्माद्वारा प्रेरित भएर” (हेर्नुहोस्ः [[rc://ne/ta/man/translate/figs-idiom]])
12:36	dv7b		rc://*/ta/man/translate/figs-explicit	εἶπεν & εἶπεν ὁ Κύριος τῷ Κυρίῳ μου	1	यहाँ दाऊदले परमेश्‍वरलाई “परमप्रभु” र ख्रीष्‍टलाई “मेरा प्रभु” भन्छन् । यसलाई अझ प्रस्टसँग लेख्‍न सकिन्छ । वैकल्पिक अनुवादः “मसीहको बारेमा भने, ‘परमेश्‍वरले मेरा प्रभुलाई भन्‍नुभयो’” (हेर्नुहोस्ः [[rc://ne/ta/man/translate/figs-explicit]])
12:36	v53p		rc://*/ta/man/translate/translate-symaction	κάθου ἐκ δεξιῶν μου	1	यो येशूले भजनसंङ्ग्रहबाट उद्धृत गर्नुभएको हो । यहाँ परमेश्‍वर ख्रीष्‍टसँग बोलिरहनुभएको छ । “परमेश्‍वरको दाहिने हात”पट्टि बस्‍नु भनेको परमेश्‍वरबाट महान् सम्‍मान वा अधिकार प्राप्‍त गर्ने कुरालाई जनाउने साङ्केतिक कार्य हो । वैकल्‍पिक अनुवादः “मेरो छेउमा सम्‍मानको स्थानमा बस्‍नु” (हेर्नुहोस्ः [[rc://ne/ta/man/translate/translate-symaction]])
12:36	mml8		rc://*/ta/man/translate/figs-metaphor	ἕως ἂν θῶ τοὺς ἐχθρούς σου ὑποκάτω τῶν ποδῶν σου	1	यसमा परमेश्‍वरले शत्रुहरूलाई हराउनलाई तिनीहरूलाई पाउदान बनाउनेको रूपमा बताउनुहुन्छ । वैकल्पिक अनुवादः “मैले तिम्रा शत्रुहरूलाई पूर्ण रूपमा नहराएसम्म” (हेर्नुहोस्ः [[rc://ne/ta/man/translate/figs-metaphor]])
12:37	ka5u			λέγει αὐτὸν, Κύριον	1	यहाँ “उहाँलाई”ले ख्रीष्‍टलाई जनाउँछ ।
12:37	rh2t		rc://*/ta/man/translate/figs-rquestion	καὶ πόθεν υἱός αὐτοῦ ἐστιν?	1	यसलाई एउटा भनाइको रूपमा लेख्‍न सकिन्छ । वैकल्पिक अनुवादः “त्यसैले, ख्रीष्‍ट कसरी दाऊदका सन्तान हुन सक्छन् भनी विचार गर” (हेर्नुहोस्ः [[rc://ne/ta/man/translate/figs-rquestion]])
12:38	k31m		rc://*/ta/man/translate/figs-abstractnouns	ἀσπασμοὺς ἐν ταῖς ἀγοραῖς	1	“अभिवादनहरू” भन्‍ने नामपद शब्दलाई “अभिवादन गर्नु” भन्‍ने क्रियापदको साथमा व्यक्त गर्न सकिन्छ । मानिसहरूले शास्‍त्रीहरूलाई आदर गर्थे भन्‍ने कुरालाई यी अभिवादनहरू देखायो । वैकल्पिक अनुवादः “र बजारहरूमा आदरपूर्वक अभिवादन गरिनलाई” वा “बजारहरूमा मानिसहरूले आदरपूर्वक अभिवादन गर्नको लागि” (हेर्नुहोस्ः [[rc://ne/ta/man/translate/figs-abstractnouns]] अनि [[rc://ne/ta/man/translate/figs-explicit]])
12:40	jtw4		rc://*/ta/man/translate/figs-metaphor	οἱ κατεσθίοντες τὰς οἰκίας τῶν χηρῶν	1	यहाँ येशूले शास्‍त्रीहरूले विधवाहरूलाई ठगेको र तिनीहरूको घर चोरेको कुरालाई तिनीहरूको घर खाएको रूपमा व्याख्या गर्नुहुन्छ । वैकल्पिक अनुवादः “तिनीहरूले विधवाहरूका घरहरू तिनीहरूबाट चोर्न तिनीहरूलाई ठग्छन्” (हेर्नुहोस्ः [[rc://ne/ta/man/translate/figs-metaphor]])
12:40	j27b		rc://*/ta/man/translate/figs-synecdoche	τὰς οἰκίας τῶν χηρῶν	1	“विधवाहरू” र “घरहरू” भन्‍ने शब्दहरू सहयोगविहीन भएका र कोही व्यक्तिका महत्त्वपूर्ण जायजेथाहरूलाई क्रमशः जनाउने प्रतिस्थापकीय शब्दहरू हुन् । वैकल्‍पिक अनुवादः “”everything from helpless people“” (हेर्नुहोस्ः [[rc://ne/ta/man/translate/figs-synecdoche]])
12:40	qm52		rc://*/ta/man/translate/figs-activepassive	οὗτοι λήμψονται περισσότερον κρίμα	1	यसलाई कर्तृवाच्यमा उल्लेख गर्न सकिन्छ । वैकल्पिक अनुवादः “परमेश्‍वरले तिनीहरूलाई अझ ठूलो दण्डसहित दण्ड दिनुहुनेछ” वा “परमेश्‍वरले तिनीहरूलाई निश्‍चय पनि कडाइका साथ दण्ड दिनुहुनेछ” (हेर्नुहोस्ः [[rc://ne/ta/man/translate/figs-activepassive]])
12:40	h36x		rc://*/ta/man/translate/figs-explicit	λήμψονται περισσότερον κρίμα	1	“अझ ठूलो”ले तुलना गर्छ । यहाँ यो दण्ड पाउने अरू मानिसहरूसँग तुलना गरिएको छ । वैकल्पिक अनुवादः “अरू मानिसहरूले भन्दा अझ ठूलो दण्ड पाउनेछन्” (हेर्नुहोस्ः [[rc://ne/ta/man/translate/figs-explicit]])
12:41	r69x			जोड्ने कथनः	0	अझै पनि येशूले मन्दिर परिसरमा नै विधवाको भेटीको मूल्यबारे टिप्पणी गर्नुहुन्छ ।
12:41	p2kp			τοῦ γαζοφυλακίου	1	यो बाकसमा, जसलाई सबै मानिसहरूले प्रयोग गर्न सक्थे, मन्दिरको भेटी सङ्कलन हुन्थ्यो ।
12:42	g6ry		rc://*/ta/man/translate/translate-bmoney	λεπτὰ δύο	1	“तामाका दुईवटा साना सिक्‍काहरू” । यी उपलब्ध सिक्‍काहरूमा सबैभन्दा कम मूल्यका थिए । (हेर्नुहोस्ः [[rc://ne/ta/man/translate/translate-bmoney]])
12:42	n29e			ἐστιν κοδράντης	1	“निकै कम मूल्य भएको ।” मुद्रा भनेको निकै कम मूल्यको हुन्छ । यदि निकै कम मूल्यको सिक्‍का छ भने, “मुद्रा”लाई तपाईंको भाषामा भएको सबैभन्दा कम मूल्यको सिक्‍काको नामलाई प्रयोग गरेर अनुवाद गर्नुहोस् ।
12:43	ipl1		rc://*/ta/man/translate/translate-versebridge	सामान्य जानकारीः	0	पद ४३ मा येशूले भन्‍नुहुन्छ कि त्यस विधवाले धनी मानिसहरूले राखेको भन्दा बढी पैसा राखिन्, र पद ४४ मा उहाँले त्यसो भन्‍नुको कारण बताउनुहुन्छ । यस जानकारीलाई पुनः क्रम मिलाएर राख्‍न सकिन्छ ताकि येशूले उहाँको कारण पहिला भन्‍नुहुन्छ र त्यसपछि विधवाले बढी हालिन् भनेर भन्‍नुहुन्छ, जसरी यूएसटीमा गरिएको छ । (हेर्नुहोस्ः [[rc://ne/ta/man/translate/translate-versebridge]])
12:43	n7su			προσκαλεσάμενος	1	“अनि येशूले ... बोलाउनुभयो”
12:43	q124			ἀμὴν, λέγω ὑμῖν	1	यसले सङ्केत गर्छ कि यसपछि आएको भनाइ विशेष रूपमा सत्य वा महत्त्वपूर्ण छ । तपाईंले यसलाई [मर्कुस ३:२८](../03/28.md) मा कसरी अनुवाद गर्नुभयो, सो हेर्नुहोस् ।
12:43	n8z5			πάντων & τῶν βαλλόντων εἰς	1	“ती सबै अरू मानिसहरू जसले पैसा हाले”
12:44	ui9a			τοῦ περισσεύοντος	1	धेरै सम्पत्ति, धेरै बहुमूल्य थोकहरू
12:44	l4tp			τῆς ὑστερήσεως αὐτῆς	1	“तिनीसँग भएको थोरै कुरा”
12:44	p3as			τὸν βίον αὐτῆς	1	“बाँच्‍नको लागि”
13:intro	ti7d				0	# मर्कुस १३ सामान्य टिपोटहरू\n\n## संरचना र ढाँचा\n\nकेही अनुवादहरूले पढ्नलाई सजिलो बनाउनलाई कविताको हरेक पङ्क्तिलाई बाँकीको खण्‍डभन्दा दायाँतिर केही पर सार्छन् । यूएलटीले १३:२४-२५ मा भएको कवितासँग यसै गर्छ, जुन पुरानो करारबाट लिइएका शब्दहरू हुन् ।\n\n## यस अध्यायमा भएका विशेष अवधारणाहरू\n\n### ख्रीष्‍टको पुनरागमन\n\nयेशूले उहाँ फर्किनुभन्दा अगाडि के हुनेछ भन्‍ने बारेमा धेरै भन्‍नुभयो ([मर्कुस १३:६-३७](./06.md)) । उहाँले आफ्‍ना अनुयायीहरूलाई भन्‍नुभयो कि उहाँ फर्किनुभन्दा अगाडि खराब कुराहरू संसारलाई हुनेछ र खराब कुराहरू तिनीहरूलाई हुनेछ, तिनीहरू उहाँ कुनै पनि समयमा फर्किनको लागि तयार हुनुपर्थ्यो ।
13:1	rrv1			सामान्य जानकारीः	0	उहाँहरू मन्दिर परिसरबाट निस्कनुहुँदा हेरोदले बनाएको त्यो गजबको मन्दिरलाई भविष्यमा के हुने थियो भनी उहाँले आफ्ना चेलाहरूलाई भन्‍नुहुन्छ ।
13:1	ql81		rc://*/ta/man/translate/figs-explicit	ποταποὶ λίθοι καὶ ποταπαὶ οἰκοδομαί	1	“ढुङ्गाहरू”ले ढुङ्गाहरूलाई जनाउँछ जसबाट ती भवनहरू बनेका थिए । वैकल्पिक अनुवादः “गजबका भवनहरू र गजबका ढुङ्गाहरू जसबाट ती बनेका छन्” (हेर्नुहोस्ः [[rc://ne/ta/man/translate/figs-explicit]])
13:2	rez6		rc://*/ta/man/translate/figs-rquestion	βλέπεις ταύτας τὰς μεγάλας οἰκοδομάς? οὐ μὴ & λίθος	1	यो प्रश्‍न भवनहरूतिर ध्यान खिँच्नलाई प्रयोग गरिएको हो । यसलाई कथनको रूपमा लेख्‍न सकिन्छ । वैकल्पिक अनुवादः “यी ठुला भवनहरूलाई हेर ! एउटा ढुङ्गा पनि” वा “अहिले तिमीहरूले यी ठुला भवनहरू देख्छौ, तर एउटा ढुङ्गा पनि” (हेर्नुहोस्ः [[rc://ne/ta/man/translate/figs-rquestion]])
13:2	zu46		rc://*/ta/man/translate/figs-explicit	οὐ μὴ ἀφεθῇ ὧδε λίθος ἐπὶ λίθον, ὃς οὐ μὴ καταλυθῇ	1	शत्रु सेनाहरूले ढुङ्गाहरूलाई भत्काउनेछन् भन्‍ने आशय दिइएको छ । यसलाई कर्तृवाच्यमा उल्लेख गर्न सकिन्छ । वैकल्पिक अनुवादः “एउटा ढुङ्गामाथि अर्को ढुङ्गा रहनेछैन, किनभने शत्रु सेनाहरू आउनेछन् र यी भवनहरू नष्‍ट पार्नेछन्” (हेर्नुहोस्ः [[rc://ne/ta/man/translate/figs-explicit]] अनि [[rc://ne/ta/man/translate/figs-activepassive]])
13:3	e913			जोड्ने कथनः	0	के हुन गइरहेको थियो भन्‍ने चेलाहरूको प्रश्‍नको जवाफ दिँदै येशूले भविष्यमा के हुन गइरहेको थियो भनी बताउनुहुन्छ ।
13:3	izt8		rc://*/ta/man/translate/figs-explicit	καὶ καθημένου αὐτοῦ εἰς τὸ Ὄρος τῶν Ἐλαιῶν κατέναντι τοῦ ἱεροῦ & Πέτρος	1	येशू र उहाँका चेलाहरू जैतूनको पहाडसम्‍म हिँड्नुभएको थियो भनेर प्रस्‍टसँग व्यक्त गर्न सकिन्छ । वैकल्पिक अनुवादः “मन्दिरको सामुन्‍नेमा भएको जैतून डाँडामा आइपुग्‍नुभएपछि येशू बस्‍नुभयो । त्यसपछि पत्रुस” (हेर्नुहोस्ः [[rc://ne/ta/man/translate/figs-explicit]])
13:3	u7ju			κατ’ ἰδίαν	1	जब उहाँहरू एक्लै हुनुहुन्थ्यो
13:4	uf37		rc://*/ta/man/translate/figs-explicit	ταῦτα ἔσται & μέλλῃ & συντελεῖσθαι	1	यसले येशूले ढुङ्गाहरूलाई के हुन्छ भन्‍नुभएको थियो त्यसलाई जनाउँछ । यसलाई स्पष्‍ट बनाउन सकिन्छ । वैकल्पिक अनुवादः “यी कुरा मन्दिरका भवनहरूलाई हुनेछन् ... मन्दिरका भवनहरूलाई हुन लागेका छन्” (हेर्नुहोस्ः [[rc://ne/ta/man/translate/figs-explicit]])
13:4	lw1n			ὅταν & ταῦτα & πάντα	1	“कि यी सबै कुराहरू”
13:5	fe42			λέγειν αὐτοῖς	1	“उहाँका चेलाहरूलाई”
13:5	u79c			ὑμᾶς πλανήσῃ	1	यहाँ “तिमीहरूलाई बहकाउँछ” भनेको कसैलाई कुनै असत्य कुरा विश्‍वास गर्न मनाउने कुरालाई जनाउने अलङ्कार हो । वैकल्पिक अनुवादः “तिमीहरूलाई छल्छ” (हेर्नुहोस्ः [[rc://ne/ta/man/translate/figs-metaphor]])
13:6	wv12			πολλοὺς πλανήσουσιν	1	यहाँ “ ... बहकाउने” भनेको कसैलाई कुनै असत्य कुरा विश्‍वास गर्न मनाउने कुरालाई जनाउने अलङ्कार हो । वैकल्‍पिक अनुवादः “तिनीहरूले धेरै मानिसहरूलाई छल्‍नेछन्” (हेर्नुहोस्ः [[rc://ne/ta/man/translate/figs-metaphor]])
13:6	z63u		rc://*/ta/man/translate/figs-metonymy	ἐπὶ τῷ ὀνόματί μου	1	सम्भावित अर्थहरू हुन् १) “मेरो अधिकारको दाबी गर्दै” वा २) “परमेश्‍वरले तिनीहरूलाई पठाउनुभएको दाबी गर्दै ।” (हेर्नुहोस्ः [[rc://ne/ta/man/translate/figs-metonymy]])
13:6	l7f9			ἐγώ εἰμι	1	“म नै ख्रीष्‍ट हुँ”
13:7	fl5h			ἀκούσητε πολέμους καὶ ἀκοὰς πολέμων	1	“युद्धहरू र युद्धहरूको बारेमा खबरहरू सुन्‍नेछौ ।” सम्भावित अर्थहरू हुन् १) “नजिकमा युद्धहरूका वास्तविक आवाजहरू र टाढामा युद्धका खबरहरू सुन्‍नेछौ” वा २) “सुरु भइसकेको युद्धको बारेमा र मानिसहरूले युद्धहरू सुरु गर्न गइरहेको खबर सुन्‍नेछौ”
13:7	d1k9			ἀλλ’ οὔπω τὸ τέλος	1	“तैपनि यो संसारको अन्त्य होइन” वा “तर अन्त चाहिँ ... नभएसम्‍म हुनेछैन” वा “तर अन्त पछि हुनेछ”
13:7	mi4d		rc://*/ta/man/translate/figs-explicit	τὸ τέλος	1	यसले सम्भवतः संसारको अन्त्यलाई जनाउँछ । (हेर्नुहोस्ः [[rc://ne/ta/man/translate/figs-explicit]])
13:8	xln4		rc://*/ta/man/translate/figs-idiom	ἐγερθήσεται & ἐπ’	1	यो टुक्‍काको अर्थ एक अर्काको विरुद्धमा लड्नु भन्‍ने हुन्छ । वैकल्पिक अनुवादः “विरुद्धमा लड्नेछ” (हेर्नुहोस्ः [[rc://ne/ta/man/translate/figs-idiom]])
13:8	e2ln		rc://*/ta/man/translate/figs-ellipsis	βασιλεία ἐπὶ βασιλείαν	1	“उठ्नेछ” भन्‍ने शब्दलाई अगाडिको वाक्यांशबाट बुझिएको छ । वैकल्पिक अनुवादः “राज्यको विरुद्ध राज्य उठ्नेछ” वा “एउटा राज्यको मानिसहरू अर्को राज्यका मानिसहरूका विरुद्धमा लड्नेछन्” (हेर्नुहोस्ः [[rc://ne/ta/man/translate/figs-ellipsis]])
