Reference	ID	Tags	SupportReference	Quote	Occurrence	Note
9:intro	n92j				0	# मर्कुस ०९ सामान्य टिपोटहरू\n\n## यस अध्यायमा भएका विशेष अवधारणाहरू\n\n### “रूप परिवर्तन भएको”\n\nधर्मशास्‍त्रले धेरैपटक परमेश्‍वरको महिमालाई एउटा महान्, चखिलो ज्योतिको रूपमा कुरा गर्छ । जब मानिसहरूले यस ज्योतिलाई देख्‍छन्, तिनीहरू डराउँछन् । मर्कुसले यस अध्यायमा भन्छन् कि येशूको वस्‍त्र यस महिमामय ज्योतिका साथमा चम्कियो जसले गर्दा उहाँका अनुयायीहरूले येशू साँच्‍चै परमेश्‍वरको पुत्र हुनुहुन्थ्यो भनेर देख्‍न सके । त्यही समयमा, परमेश्‍वरले तिनीहरूलाई भन्‍नुभयो कि येशू उहाँको पुत्र हुनुहन्थ्यो । (हेर्नुहोस्ः [[rc://ne/tw/dict/bible/kt/glory]] अनि [[rc://ne/tw/dict/bible/kt/fear]])\n\n## यस अध्यायमा भएका भाषाका महत्त्वपूर्ण अलङ्कारहरू\n\n### अतिशयोक्ति\n\nयेशूले ती कुराहरू भन्‍नुभयो जसलाई उहाँका अनुयायीहरूले शाब्दिक रूपमा जस्ताको तस्तै बुझेको अपेक्षा गर्नुभएन । जब उहाँले भन्‍नुभयो, “यदि तिम्रो हातले तिमीलाई ठेस खान लगाउँछ भने, त्यसलाई काटिदेऊ” ([मर्कुस ९:४३](../../mrk/09/43.md)), उहाँले अतिरञ्‍जन गरेर बोलिरहनुभएको थियो ताकि तिनीहरूलाई थाहा होस् कि तिनीहरू त्यस्तो कुनै पनि कुराबाट टाढा रहनुपर्छ जसले तिनीहरूलाई पाप गर्न लगाउँछ, तब पनि टाढा रहनुपर्छ जब त्यो कुरा तिनीहरूले मन पराएका वा तिनीहरूलाई चाहिन्छ भनी सोचेका कुरा हो ।\n\n## यस अध्यायमा भएका अनुवादका अन्य सम्भाव्य कठिनाइहरू\n\n### एलिया र मोशा\n\nएलिया र मोशा अचानक येशू, याकूब, यूहन्‍ना, र पत्रुसकहाँ देखा पर्छन्, र त्यसपछि अल्‍पिन्छन् । उहाँहरू चारैजनाले एलिया र मोशालाई देख्‍नुहुन्छ, र किनभने एलिया र मोशाले येशूसँग कुरा गरे, पाठकले बुझ्‍नुपर्छ कि एलिया र मोशा शारीरिक रूपमा देखा परे ।\n\n### “मानिसको पुत्र”\n\nयस अध्यायमा येशूले आफैँलाई “मानिसको पुत्र” भनेर जनाउनुभयो ([मर्कुस ९:३१](../../mrk/09/31.md)) । तपाईंको भाषाले मानिसहरूलाई तिनीहरूको आफ्‍नै बारेमा कोही अरूको बारेमा कुरा गरिरहेको झैँ गरेर बोल्‍न नदिन सक्छ । (हेर्नुहोस्ः [[rc://ne/tw/dict/bible/kt/sonofman]] अनि [[rc://ne/ta/man/translate/figs-123person]])\n\n### विरोधाभासी भनाइ\n\nविरोधाभासी भनाइ भनेको सत्य कथन हो जसले कुनै असम्भव कुरालाई वर्णन गरेको जस्तो देखिन्छ । येशूले विरोधाभासी भनाइलाई प्रयोग गर्नुहुन्छ जब उहाँले भन्‍नुहुन्छ, “यदि कोही प्रथम हुन चाहन्छ भने, ऊ सबैभन्दा अन्तिमको र सबैको सेवक हुनुपर्छ” ([मर्कुस ९:३५](../../mrk/09/35.md)) ।
9:1	mt8p			जोड्ने कथनः	0	येशूले आफ्ना चेलाहरू र मानिसहरूसँग उहाँलाई पछ्याउनेबारे कुरा गरिरहनुभएको छ । छ दिनपछि, उहाँ चेलाहरूसँग पहाडमाथि जानुहुन्छ, जहाँ उहाँको मुहार परिवर्तन हुन्छ र उहाँ परमेश्‍वरको राज्यमा कुनै दिन देखिनुहुनेजस्तै देखिनुहुन्छ ।
9:1	q4b6			ἔλεγεν αὐτοῖς	1	“येशूले उहाँका चेलाहरूलाई भन्‍नुभयो”
9:1	yjf6		rc://*/ta/man/translate/figs-metonymy	τὴν Βασιλείαν τοῦ Θεοῦ ἐληλυθυῖαν ἐν δυνάμει	1	परमेश्‍वरको राज्य आउनुले परमेश्‍वरले आफैँलाई राजाको रूपमा देखाउनुहुने कुरालाई जनाउँछ । वैकल्पिक अनुवादः “परमेश्‍वरले आफैँलाई ठूलो शक्तिका साथ राजाको रूपमा प्रकट गर्नुहुन्छ” (हेर्नुहोस्ः [[rc://ne/ta/man/translate/figs-metonymy]])
9:2	uf5f		rc://*/ta/man/translate/figs-rpronouns	κατ’ ἰδίαν μόνους	1	लेखकले यहाँ उहाँहरू एक्‍लै हुनुहुन्थ्यो र केवल येशू, पत्रुस, याकूब, र यूहन्‍ना मात्रै माथि पहाडमा जानुभयो भनेर जोड दिनका लागि निजवाचक सर्वनाम “उहाँहरू”को प्रयोग गर्छन् । (हेर्नुहोस्ः [[rc://ne/ta/man/translate/figs-rpronouns]])
9:2	krt6			μετεμορφώθη ἔμπροσθεν αὐτῶν	1	जब तिनीहरूले उहाँलाई हेरे, उहाँको स्वरूप पहिले भएकोभन्दा भिन्दै थियो ।
9:2	b3bb		rc://*/ta/man/translate/figs-activepassive	μετεμορφώθη	1	यसलाई कर्तृवाच्यमा उल्लेख गर्न सकिन्छ । वैकल्पिक अनुवादः “उहाँको स्वरूप परिवर्तन भएको थियो” वा “उहाँ धेरै फरक देखिनुभयो” (हेर्नुहोस्ः [[rc://ne/ta/man/translate/figs-activepassive]])
9:2	i9vm			ἔμπροσθεν αὐτῶν	1	“तिनीहरूको सम्मुख” वा “ताकि तिनीहरूले उहाँलाई प्रस्‍टसँग देख्‍न सकून्”
9:3	id6l			στίλβοντα	1	“टल्किरहेको” वा “बलिरहेको ।” येशूका लुगाहरू यति चहकिला थिए कि तिनीहरूले उज्यालो दिइरहेका थिए ।
9:3	s2qf			λείαν	1	सम्भव भएसमम वा सबैभन्दा ज्यादाभन्दा पनि बढी
9:3	gp48			οἷα γναφεὺς ἐπὶ τῆς γῆς οὐ δύναται οὕτως λευκᾶναι	1	यसले प्राकृतिक उनलाई अझ धेरै सेतो बनाउन दाग हटाउने ब्लिच वा एमिनियाजस्ता रासायनिक पदार्थ प्रयोग गर्ने प्रक्रियाको वर्णन गर्छ । वैकल्पिक अनुवादः “पृथ्वीका कुनै पनि मानिसले सेतो बनाउन सक्‍नेभन्दा बढी सेतो”
9:4	f2d6		rc://*/ta/man/translate/figs-explicit	ὤφθη & Ἠλείας σὺν Μωϋσεῖ	1	यी मानिसहरू को हुन् भनी उल्लेख गर्नु उपयुक्त हुन सक्छ । वैकल्पिक अनुवादः “धेरै लामो समयअगिका अगमवक्ताहरू, मोशा र एलिया, देखा परे” (हेर्नुहोस्ः [[rc://ne/ta/man/translate/figs-explicit]])
9:4	pj3i			ἦσαν συνλαλοῦντες	1	यहाँ “तिनीहरू”ले एलिया र मोशालाई जनाउँछ ।
9:5	w6vs			ἀποκριθεὶς ὁ Πέτρος λέγει τῷ Ἰησοῦ	1	“पत्रुसले येशूलाई भने ।” यहाँ “जवाफ दिए” लाई वार्तालावमा पत्रुसलाई चिनाउन प्रयोग गरिएको छ । पत्रुसले प्रश्‍नको जवाफ दिइरहेका थिएनन् ।
9:5	iqc9		rc://*/ta/man/translate/figs-exclusive	καλόν ἐστιν ἡμᾶς ὧδε εἶναι	1	“हामीलाई” भन्‍ने शब्दले पत्रुस, याकूब, र यूहन्‍नालाई मात्र जनाउँछ वा त्यहाँ हुनुभएका येशू, एलिया, र मोशा गरेर सबैलाई जनाउँछ भनेर स्‍पष्‍ट छैन । यदि दुवै छनोटहरूलाई सम्भव देखाउने गरी तपाईंले अनुवाद गर्न सक्‍नुहुन्छ भने, त्यसो गर्नुहोस् । (हेर्नुहोस्ः [[rc://ne/ta/man/translate/figs-exclusive]] अनि [[rc://ne/ta/man/translate/figs-inclusive]])
9:5	k3y1			σκηνάς	1	सामान्य, अस्थायी ठाउँहरू जसमा बस्‍न र सुत्‍न सकिन्छ
9:6	r3bn		rc://*/ta/man/translate/writing-background	οὐ γὰρ ᾔδει τί ἀποκριθῇ; ἔκφοβοι γὰρ ἐγένοντο	1	यो कोष्‍ठभित्र दिइएको वाक्यले पत्रुस, याकूब र यूहन्‍नाको पृष्‍ठभूमिबारे केही कुरा बताउँछ । (हेर्नुहोस्ः [[rc://ne/ta/man/translate/writing-background]])
9:6	f8hn			ἔκφοβοι & ἐγένοντο	1	“तिनीहरू अति डराएका थिए” वा “तिनीहरू असाध्यै डराएका थिए”
9:7	e3id			ἐγένετο & ἐπισκιάζουσα	1	“देखा पर्‍यो र ढाक्यो”
9:7	x4mv		rc://*/ta/man/translate/figs-metonymy	καὶ ἐγένετο φωνὴ ἐκ τῆς νεφέλης	1	“आवाज आयो” भनेको कोही बोलिरहेको कुराको निम्ति प्रतिस्थापकीय शब्द हो । कसले बोल्‍यो भनेर स्‍पष्‍ट तवरमा व्यक्त गर्न पनि सकिन्छ । वैकल्पिक अनुवादः “तब कसैले बादलबाट बोल्‍नुभयो” वा “तब परमेश्‍वर बादलबाट बोल्नुभयो” (हेर्नुहोस्ः [[rc://ne/ta/man/translate/figs-metonymy]] अनि [[rc://ne/ta/man/translate/figs-explicit]])
9:7	hn9m			οὗτός ἐστιν ὁ Υἱός μου, ὁ ἀγαπητός, ἀκούετε αὐτοῦ	1	परमेश्‍वर पिताले उहाँका “प्रिय पुत्र”, परमेश्‍वरको पुत्रको निम्ति उहाँको प्रेम व्यक्त गर्नुहुन्छ ।
9:7	ybu6		rc://*/ta/man/translate/guidelines-sonofgodprinciples	ὁ Υἱός & ὁ ἀγαπητός	1	यो येशू, परमेश्‍वरको पुत्रको निम्ति महत्त्वपूर्ण पदवी हो । (हेर्नुहोस्ः [[rc://ne/ta/man/translate/guidelines-sonofgodprinciples]])
9:8	hq73			περιβλεψάμενοι	1	यहाँ “तिनीहरू”ले पत्रुस, याकूब र यूहन्‍नालाई जनाउँछ ।
9:9	dv4d		rc://*/ta/man/translate/figs-explicit	διεστείλατο αὐτοῖς ἵνα μηδενὶ & εἰ μὴ ὅταν ὁ Υἱὸς τοῦ Ἀνθρώπου ἐκ νεκρῶν ἀναστῇ	1	उहाँले यो कुरालाई उहाँ मृत्युबाट जीवित हुनुभएपछि मात्र तिनीहरूलाई भन्‍ने अनुमति दिनुभयो भन्‍ने आशयलाई यसले व्यक्त गर्छ । (हेर्नुहोस्ः [[rc://ne/ta/man/translate/figs-explicit]])
9:9	w98g		rc://*/ta/man/translate/figs-metonymy	ἐκ νεκρῶν ἀναστῇ	1	“मृतकहरूमध्येबाट जीवित भएको ।” यसको अर्थ फेरि जीवित हुनु हुन्छ । मृतकहरूले मरेका मानिसहरूलाई जनाउँछ र यो रूपकले मृत्युलाई जनाउँछ । वैकल्‍पिक अनुवादः “मृत्युबाट बिउँतनुभएको” (हेर्नुहोस्ः [[rc://ne/ta/man/translate/figs-metonymy]])
9:10	wfu9		rc://*/ta/man/translate/figs-metonymy	ἐκ νεκρῶν ἀναστῆναι	1	“मृतकहरूमध्येबाट जीवित हुनु ।” यसको अर्थ फेरि जीवित हुनु हुन्छ । मृतकहरूले मरेका मानिसहरूलाई जनाउँछ र यो रूपकले मृत्युलाई जनाउँछ । वैकल्‍पिक अनुवादः “”rising from death“” (हेर्नुहोस्ः [[rc://ne/ta/man/translate/figs-metonymy]])
9:10	b8y9		rc://*/ta/man/translate/figs-idiom	καὶ τὸν λόγον ἐκράτησαν πρὸς ἑαυτοὺς	1	यहाँ “ती कुराहरू तिनीहरूले आफैँसँग राखे” भनेको टुक्‍का हो जसको अर्थ तिनीहरूले देखेका कुरा कसैलाई पनि भनेनन् भन्‍ने हुन्छ । वैकल्पिक अनुवादः “त्यसैले, आफूले देखेका कुराको बारेमा तिनीहरूले कसैलाई पनि भनेनन्” (हेर्नुहोस्ः [[rc://ne/ta/man/translate/figs-idiom]])
9:11	pck1			जोड्ने कथनः	0	“मृत्युबाट जीवित भई उठ्‍नु” भन्‍नुको अर्थ के हो भनी पत्रुस, याकूब र यूहन्‍ना अलमल्लमा परेका भए तापनि तिनीहरूले एलियाको आगमनको बारेमा सोधे ।
9:11	s9zn			ἐπηρώτων αὐτὸν	1	“तिनीहरू” शब्दले पत्रुस, याकूब, र यूहन्‍नालाई जनाउँछ ।
9:11	h45a		rc://*/ta/man/translate/figs-explicit	λέγουσιν οἱ γραμματεῖς ὅτι Ἠλείαν δεῖ ἐλθεῖν πρῶτον?	1	अगमवाणी अनुसार एलिया स्वर्गबाट फेरि आउँछन् । अनि मानिसका पुत्र अर्थात् मसीह शासन गर्न र राज्य गर्न आउनुहुन्छ । मानिसको पुत्र कसरी मर्न र पुनः बिउँतन सक्‍नुहुन्थ्यो भन्‍ने बारेमा चेलाहरू अन्योलमा छन् । वैकल्‍पिक अनुवादः “शास्‍त्रीहरूले किन एलिया मसिह आउनुभन्दा अगाडि आउनुपर्छ भनेर भन्छन् ?” (हेर्नुहोस्ः [[rc://ne/ta/man/translate/figs-explicit]])
9:12	x5ep			Ἠλείας μὲν ἐλθὼν πρῶτον ἀποκατιστάνει πάντα	1	यसो भनेर, येशूले पुष्‍टि गर्नुहुन्छ कि एलिया पहिला आउने थिए ।
9:12	s3q3		rc://*/ta/man/translate/figs-rquestion	πῶς γέγραπται & ἐξουδενηθῇ?	1	येशूले उहाँका चेलाहरूलाई धर्मशास्‍त्रले मानिसको पुत्रले कष्‍ट भोग्‍नुपर्छ र घृणित हुनुपर्छ भनेर पनि सिकाउँछ भनेर सम्झाउनलाई यस प्रश्‍नको प्रयोग गर्नुहुन्छ । यसलाई कथनको रूपमा व्यक्त गर्न सकिन्छ । वैकल्पिक अनुवादः “तर म तिमीहरूले धर्मशास्‍त्रमा मानिसका पुत्रको बारेमा लेखिएको कुरा विचार गरेको चाहन्छु । धर्मशास्‍त्रले भन्छ कि उसले धेरै कष्‍ट भोग्‍नुपर्छ र घृणित हुनुपर्छ ।” (हेर्नुहोस्ः [[rc://ne/ta/man/translate/figs-rquestion]])
9:12	i3j7		rc://*/ta/man/translate/figs-activepassive	ἐξουδενηθῇ	1	यसलाई कर्तृ वाच्यमा उल्लेख गर्न सकिन्छ । वैकल्पिक अनुवादः “मानिसहरूले उसलाई घृणा गर्ने थिए” (हेर्नुहोस्ः [[rc://ne/ta/man/translate/figs-activepassive]])
9:13	k3kj		rc://*/ta/man/translate/figs-explicit	ἐποίησαν αὐτῷ ὅσα ἤθελον	1	मानिसहरूले एलियालाई गरेका कुरा उल्लेख गर्नु उपयुक्त हुन सक्छ । वैकल्पिक अनुवादः “अनि हाम्रा अगुवाहरूले तिनलाई तिनीहरूले चाहे अनुसार व्यवहार गरे” (हेर्नुहोस्ः [[rc://ne/ta/man/translate/figs-explicit]])
9:14	qn7d			जोड्ने कथनः	0	येशू, पत्रुस, याकूब र यूहन्‍ना डाँडाबाट तल आउँदा तिनीहरूले शास्‍त्रीहरूले अरू चेलाहरूसँग विवाद गरिरहेका पाए ।
9:14	n8fd			ἐλθόντες πρὸς τοὺς μαθητὰς	1	येशू पत्रुस, याकूब र यूहन्‍ना डाँडामाथि नगएका अरू चेलाहरूकहाँ फर्केर आउनुभयो ।
9:14	cs1f			εἶδον ὄχλον πολὺν περὶ αὐτοὺς	1	“येशू र ती तीन चेलाहरूले अरू चेलाहरूको वरिपरि एउटा ठूलो भीड लागेको देख्‍नुभयो”
9:14	wp9z			γραμματεῖς συνζητοῦντας πρὸς αὐτούς	1	येशूसँग नगएका चेलाहरूसँग शास्‍त्रीहरूले विवाद गरिरहेका थिए ।
9:15	lch5		rc://*/ta/man/translate/figs-explicit	ἐξεθαμβήθησαν	1	तिनीहरू किन छक्‍क परे भनी उल्लेख गर्नु उपयुक्त हुन सक्छ । वैकल्पिक अनुवादः “येशू आउनुभएकोमा चकित भए” (हेर्नुहोस्ः [[rc://ne/ta/man/translate/figs-explicit]])
9:17	b7v8			जोड्ने कथनः	0	शास्‍त्रीहरू र चेलाहरूका बीचमा के बहस भइरहेको थियो भनी व्याख्या गर्न भूत लागेको केटाको बुबाले चेलाहरूलाई त्यसको छोराबाट भूत निकालिदेओ भनेको तर तिनीहरूले सकेनन् भने । त्यसपछि येशूले त्यो केटाबाट भूत निकाल्नुहुन्छ । पछि तिनीहरूले किन भूत निकाल्न सकेनन् भनी चेलाहरूले सोध्छन् ।
9:17	zqw9		rc://*/ta/man/translate/figs-idiom	ἔχοντα πνεῦμα	1	यसको अर्थ हुन्छ, कि त्यो केटासँग भूत छ । “त्यससँग अशुद्ध आत्मा छ” वा “त्यसलाई अशुद्ध आत्मा लागेको छ” (हेर्नुहोस्ः [[rc://ne/ta/man/translate/figs-idiom]])
9:18	zhc9			ἀφρίζει	1	जिउ बटार्ने, वा मस्‍तिष्‍कको असन्तुलनले एक व्यक्तिलाई सास फेर्न वा निल्‍नलाई समस्या बनाउन सक्‍छ । यसले मुखबाट फिँज आउने बनाउँछ । यदि तपाईंको भाषामा त्यसलाई वर्णन गर्ने कुनै तरिका छ भने, तपाईंले त्यसलाई प्रयोग गर्न सक्‍नुहुन्छ । वैकल्‍पिक अनुवादः “उसको मुखबाट पानीका फोकाहरू आउँछन्”
9:18	h98h			ξηραίνεται	1	“ऊ करक्‍क पर्छ” वा “उसको शरीर अरट्ठ पर्छ”
9:18	zre6		rc://*/ta/man/translate/figs-ellipsis	οὐκ ἴσχυσαν	1	यसले चेलाहरूले आत्मालाई त्यस केटाबाट बाहिर निकाल्‍न नसकेको कुरालाई जनाउँछ । वैकल्पिक अनुवादः “तिनीहरूले त्यसबाट निकाल्न सकेनन्” (हेर्नुहोस्ः [[rc://ne/ta/man/translate/figs-ellipsis]])
9:19	tb67		rc://*/ta/man/translate/figs-explicit	ὁ & ἀποκριθεὶς αὐτοῖς	1	येशूलाई बिन्ती गर्ने केटाको बुबा थिए, तैपनि येशूले पूरा भीडलाई जवाफ दिनुहुन्छ । यसलाई स्पष्‍ट पार्न सकिन्छ । वैकल्पिक अनुवादः “येशूले भीडलाई जवाफ दिनुभयो” (हेर्नुहोस्ः [[rc://ne/ta/man/translate/figs-explicit]])
9:19	azc9			ὦ γενεὰ ἄπιστος	1	“तिमीहरू अविश्‍वासी पुस्ता ।” येशू भीडलाई जवाफ दिन लाग्‍नुहुँदा तिनीहरूलाई यसो भन्‍नुहुन्छ ।
